<?xml version="1.0"?>
<!DOCTYPE signalml SYSTEM "SignalML_2_0.dtd">
<signalml>

	<header>
		<format_id>
		  <info>
		    testfile for ifs
		  </info>
		</format_id>
	</header>

	<param id='p1' type='int'>
		<expr>1</expr>
	</param>
	<if id='if1' test='1'>
		<param id='p1' type='int'>
			<expr>1</expr>
		</param>
		<else-if test='0'>
			<param id='p1' type='int'>
				<expr>2</expr>
			</param>
			<else-if test='0'>
				<param id='p1' type='int'>
					<expr>3</expr>
				</param>
				<else>
					<param id='p1' type='int'>
						<expr>4</expr>
					</param>
				</else>
			</else-if>
		</else-if>

		<if id='if11' test='1'>
			<param id='p1' type='int'>
				<expr>1</expr>
			</param>
			<else-if test='0'>
				<param id='p1' type='int'>
					<expr>2</expr>
				</param>
				<else-if test='0'>
					<param id='p1' type='int'>
						<expr>3</expr>
					</param>
					<else>
						<param id='p1' type='int'>
							<expr>4</expr>
						</param>
					</else>
				</else-if>
			</else-if>

			<if id='if111' test='0'>
				<param id='p1' type='int'>
					<expr>1</expr>
				</param>
				<else-if test='1'>
					<param id='p1' type='int'>
						<expr>2</expr>
					</param>
					<else-if test='0'>
						<param id='p1' type='int'>
							<expr>3</expr>
						</param>
						<else>
							<param id='p1' type='int'>
								<expr>4</expr>
							</param>
						</else>
					</else-if>

					<if id='if1111' test='0'>
						<param id='p1' type='int'>
							<expr>1</expr>
						</param>
						<else-if test='0'>
							<param id='p1' type='int'>
								<expr>2</expr>
							</param>
							<else-if test='1'>
								<param id='p1' type='int'>
									<expr>3</expr>
								</param>
								<else>
									<param id='p1' type='int'>
										<expr>4</expr>
									</param>
								</else>

								<if id='if11111' test='0'>
									<param id='p1' type='int'>
										<expr>1</expr>
									</param>
									<else-if test='0'>
										<param id='p1' type='int'>
											<expr>2</expr>
										</param>
										<else-if test='0'>
											<param id='p1' type='int'>
												<expr>3</expr>
											</param>
											<else>
												<param id='p1' type='int'>
													<expr>4</expr>
												</param>
											</else>
										</else-if>
									</else-if>
								</if>

							</else-if>
						</else-if>
					</if>

				</else-if>
			</if>

		</if>

	</if>

	<param id='p2'>
		<expr>p1 * 100000 + if1.p1 * 10000 + if1.if11.p1 * 1000 + if1.if11.if111.p1 * 100 + if1.if11.if111.if1111.p1 * 10 + if1.if11.if111.if1111.if11111.p1 * 1</expr>
	</param>

</signalml>
